,Unnamed: 0,id,factual,polyjuice,pplm,relitc,label,target,polyjuice_success,pplm_success,relitc_success,polyjuice_perplexity,pplm_perplexity,relitc_perplexity,factual_perplexity,polyjuice_edit_distance,pplm_edit_distance,relitc_edit_distance,polyjuice_tree_edit_distance,pplm_tree_edit_distance,relitc_tree_edit_distance,polyjuice_embedding_distance,pplm_embedding_distance,relitc_embedding_distance,polyjuice_implausibility,pplm_implausibility,relitc_implausibility
0,0,1,"Household spending was projected to grow at a fairly solid rate, supported by higher employment and somewhat lower energy prices but damped somewhat by lessened stimulus from gains in wealth and the need for households to rebuild savings.","The spending was projected to grow at a fairly solid rate, supported by higher employment and somewhat lower energy prices but damped somewhat by lessened stimulus from gains in wealth and the need for households to rebuild savings.","Household spending was projected to grow at a fairly solid rate, supported by higher employment and somewhat lower energy prices. growth was forecasted mainly to be positive for spending on housing, food and utilities.

however, there were","Consumer unemployment was projected to grow at a fairly solid rate, supported by higher employment and somewhat lower energy prices but damped somewhat by dampened stimulus from increases in inflation and the need for efforts to rebuild reserves.",1,2,True,True,False,72.64221954345703,33.66642761230469,78.10240173339844,58.7425537109375,0.0336134453781512,0.3865546218487395,0.2058823529411764,3.0,32.0,8.0,26.618948655751637,17.70675366838172,29.87921821657704,33.83974239840463,25.20365191625531,41.97251038789363
1,1,2,"The possibility that longer-term inflation expectations may have edged down was roughly counterbalanced by the risks that somewhat firmer inflation this year could be more persistent than expected, particularly in an economy that was projected to continue operating above its long-run potential.","The potential for a powerful climax presents itself, and penn allows it to slip away.","The possibility that longer-term inflation expectations may have edged down was roughly counterbalanced by the risks that somewhat firmer inflation this past year, as measured by cpi-u, might not have offset the weaker growth forecast in the second half of the year","The possibility that longer - run inflation expectations may have slowed down to roughly equal is supported by the risks that somewhat lower inflation inflation this year may be linked to economic growth, particularly in an economy that was projected to continue to maintain its long - run potential.",1,2,True,True,False,273.0022277832031,43.27461624145508,61.04171752929688,36.58380889892578,0.7932203389830509,0.3559322033898305,0.2847457627118644,64.0,37.0,37.0,15.337029882923028,17.781757192944827,21.51428713999724,25.63778564868057,28.885551872072742,33.53370473949511
2,2,3,"With inventories lower, firms were beginning to raise production to meet at least a portion of increased demand, and this adjustment was expected to make an important contribution to economic recovery in the fourth quarter of the year and, to a lesser extent, in 2010 as well.","With inventories lower, firms were beginning to raise production to meet at least a portion of increased demand, and this adjustment was expected to make an important contribution to economic recovery in the short run and, to a lesser extent, in 2010 as well.","With inventories lower, firms were beginning to raise production to meet at least a portion of increased demand, and this adjustment was expected to continue, with a few firms raising prices in response to lower demand. as a result, in august the average price index","With inventories lower, firms were beginning to raise production to meet at least a portion of increased demand, and this adjustment was expected to make an important contribution to economic recovery in the fourth quarter of the year and, to a lesser extent, in 2010 as well.",2,1,True,True,True,28.555179595947266,36.72937774658203,24.78444480895996,24.78445243835449,0.0797101449275362,0.3695652173913043,0.0,7.0,38.0,0.0,25.67444942260786,15.715206701961668,25.409971598046383,31.247761971251716,27.134231216879662,30.991157531244447
3,3,4,The near-term forecast again entailed a marked downshift in headline inflation as energy prices fall back consistent with readings from futures markets.,"The near-term, non-injurious, non-injurious, non-emotional, non-emotional, non-stereotypical, non-emotional and, above all, non-stereotypical features of the physical person.","The near-term forecast again entailed a marked downshift in headline inflation. consumer prices grew by 2.1 per cent in may.

the government has warned that it may not take a",The forecast - based forecast again enchantes a marked downshift in headline inflation when equity prices fall as consistent with readings in futures markets.,0,2,True,False,False,8.418243408203125,66.26982116699219,593.9462890625,126.44573974609376,0.8092105263157895,0.4473684210526316,0.2171052631578947,35.0,31.0,16.0,15.536647849190096,19.243376175651832,17.201299730845548,24.584590115477237,31.139098590368636,25.798508934937423
4,4,5,"As students of economics, you may already know that the Federal Reserve conducts monetary policy to support a strong and stable economy in the United States.","As an students of economics, you may already know that the federal reserve conducts monetary policy to support a strong and stable economy in the united states.","As students of economics, you may already know that the federal reserve conducts a monetary policy called quantitative easing, or qe. qe is the term the fed uses to describe a strategy of buying","As students of economics, you may already know that the federal reserve conducts monetary policy to support a strong and stable economy in the united states.",2,1,True,False,True,37.6057243347168,33.07119369506836,33.89069366455078,16.52524185180664,0.0445859872611464,0.4840764331210191,0.0254777070063694,8.0,39.0,7.0,20.125106752347985,23.077442397518872,22.4536793694095,31.276214182805017,33.73116514321323,32.49284948882009
5,5,6,"In particular, incoming data and anecdotal information indicated that economic activity had appreciably more forward momentum than previously perceived and that inflation pressures could be intensifying.","In particular, incoming data and anecdotal information indicated that economic activity had appreciably more forward momentum than previously predicted and that inflation pressures could be intensifying.","In particular, incoming data and anecdotal information indicated that economic activity had appreciably improved in the first half of 2017, although not by much.

this was particularly the case in the second quarter,","In particular, incoming data and anecdotal information indicated that economic activity was appreciably gaining in momentum than previously perceived and that inflation expectations could be lower than anticipated.",1,2,False,True,False,74.82308197021484,26.89374351501465,93.5138702392578,77.83987426757812,0.0246305418719211,0.4482758620689655,0.2118226600985221,1.0,34.0,11.0,18.569053754260025,17.395307590347127,28.345247683518885,37.352638235305406,27.226081053108928,40.38520117811404
6,6,7,Microeconomic studies provide corroborating information to the macroeconomic evidence of a post-1995 acceleration in productivity growth.,Microeconomic studies provide corroborating information to the macroeconomic evidence of a post-1995 acceleration in growth.,Microeconomic studies provide corroborating information to the macroeconomic evidence of the economic benefits of the aca. the aca's impact has been greater in terms of increased employment and lower rates of long-,Microeconomic models provide corroborative information to the macroeconomic projections of a post - 1995 survey of productivity growth.,0,2,False,True,False,81.42498016357422,58.471622467041016,170.73765563964844,71.2530288696289,0.0948905109489051,0.7445255474452555,0.2335766423357664,2.0,34.0,15.0,22.446921423567627,38.36396018901668,15.980876227108944,34.36771830600338,43.26882941715018,25.99439049838559
7,7,8,"Even after adjusting for the effects of strikes on reported payrolls, the employment report for August showed weak job gains.","After adjusting for the effects of the strike, the employment growth in the second half of 2016 was slightly better than the first half of 2016.","Even after adjusting for the effects of strikes on reported violence on the streets, the police have shown the highest levels of brutality against civilians in the country.

in the first","Even after adjusting for the growth of strikes on the payrolls, the employment report for august projected weak job gains.",0,2,True,True,False,12.93089199066162,29.435794830322266,96.05714416503906,52.48762893676758,0.68,0.792,0.16,32.0,32.0,7.0,21.812272783635333,14.508505532486708,23.644079230756084,28.689176018010535,24.916866079110882,30.460761067391626
8,8,9,"You know, it's interest rates, it's risk spreads, it's currency, it's the stock market, it's credit availability, it's many, many factors.","It's, it 's risk empty, it 's, it 's the stock market many, many factors.","You know, it’s interest rates, it’s risk spreads, it’s currency, it’s what's going on around the world, and you're trying to understand why that is.

so","You know, it's interest rates, it's financial policy, it's monetary, it's the stock market, it's credit availability, it's many, many factors.",2,1,False,False,False,83.59593200683594,18.423828125,16.968246459960938,14.407960891723633,0.5579710144927537,0.4710144927536231,0.1521739130434782,28.0,43.0,6.0,19.071023262217512,17.90322313325923,19.58463963344782,35.75601400389121,33.20866753707997,35.44469296054961
9,9,10,"The fundamentals underlying capital spending continued to be supportive, as business sector output expanded briskly, firms remained flush with funds, and relative price declines for high-tech equipment continued to push down its user cost.","The fundamentals of capital are the fundamentals of how governments spend their money, and how they achieve their objectives. government programs, however, are needed to help citizens to achieve their financial needs.","The fundamentals underlying capital spending continued to be supportive, as business sector output expanded briskly, firms remained active (and capital spending rose) and government spending fell.

the bank of canada kept its forecast for growth of 3","The fundamentals underlying capital spending continued to be subdued, the private sector had expanded briskly, businesses remained flush with funds, and relative domestic demand for high - tech equipment continued to hold down its user base.",1,2,True,True,False,26.169328689575195,79.39705657958984,100.40087127685548,89.27062225341797,0.7071129707112971,0.3933054393305439,0.2217573221757322,54.0,36.0,23.0,14.303342993426265,21.11708802292156,23.75357602167841,24.194499776354924,28.62764467387715,33.87885554870329
10,10,11,"Everyone, particularly people on fixed incomes, and at the lower part of the income distribution are better off with stable prices.","Everyone, particularly people on fixed incomes, and at the higher end of the distribution are better off with stable prices.","Everyone, particularly people on fixed incomes, and at the lower end of the income distribution, has to pay more for the basic public goods that society expects them to. that's why we","Everyone, particularly people on fixed incomes, and at the lower part of the income distribution are better off with stable prices.",2,1,True,True,True,39.07746505737305,22.8985538482666,45.44649505615234,45.44649505615234,0.1145038167938931,0.5725190839694656,0.0,5.0,28.0,0.0,24.668806636044685,23.878819381614655,25.88424237793264,31.561141719633508,31.304353977616735,32.159549500189954
11,11,12,"Core inflation, which excludes energy and food prices, has been running close to 1.5 percent.","Core inflation, which excludes energy and food prices, has been around running close to 1½ percent.","Core inflation, which excludes energy and food prices, has been flat for six consecutive months, despite higher oil prices.

core inflation for july, july 2017 was 1.6%","Price inflation, which excludes energy and oil prices, has been running close to 2. 5 percent.",0,2,True,True,False,48.77202987670898,23.30345916748047,54.762203216552734,24.364702224731445,0.0967741935483871,0.946236559139785,0.0967741935483871,3.0,31.0,6.0,17.808675824722396,17.611444034218202,20.2133318194199,27.473221948749917,26.86930922770874,31.64448566834174
12,12,13,"These participants cited, for example, the still-elevated levels of long-term unemployment and workers employed part time for economic reasons as well as low labor force participation.","For example, there were 65 members in the first year, 91 members at the end of the second year and 106 members in the third year.","These participants cited, for example, the still-elevated levels of long-term unemployment and workers' comp that have led to a significant number of workers not being paid for time that they actually spent on job training or continuing","These participants cited, for example, the still - elevated rates of long - term unemployment and being employed part time slowing economic recovery as well as continuing labor market contraction.",0,2,True,True,False,11.548836708068848,28.92782211303711,137.77101135253906,36.92266845703125,0.717391304347826,0.5380434782608695,0.2608695652173913,42.0,41.0,25.0,14.982776936116046,20.95573231656448,19.874621195734544,24.311385312305056,31.51748850733459,34.797603322010865
13,13,14,Members agreed that they would continue to closely monitor inflation indicators and global economic and financial developments.,Members agreed that they would continue to collect and monitor inflation indicators and global economic and financial developments.,"Members agreed that they would continue to closely monitor inflation and exchange rates during the next few months. inflation, which was expected to fall from 2.8 percent in october to",Members agreed that they would continue to closely monitor inflation indicators and forecast economic and financial developments.,2,0,False,False,True,74.08273315429688,33.36850357055664,65.66183471679688,65.97876739501953,0.0708661417322834,0.6850393700787402,0.0551181102362204,4.0,34.0,3.0,17.785261246160346,19.26747788468333,18.102916785872928,36.89059381354607,32.96540134580028,36.70416624816475
14,14,15,Participants agreed that the labor market had remained strong over the intermeeting period and that economic activity had risen at a moderate rate.,Participants agreed empty.,"Participants agreed that the labor market had remained strong over the past four years and that labor market conditions were improving. however, there had been signs that the unemployment rate was increasing. the",Participants agreed that the labor market had remained strong over the intermeeting period and that economic activity had risen at a similar rate.,2,0,False,True,True,1938.175537109375,16.479141235351562,23.872270584106445,24.7797794342041,0.8231292517006803,0.6802721088435374,0.0476190476190476,38.0,34.0,1.0,15.485083440093131,17.6478157673524,19.564227650074688,36.55431388612209,29.64293519849184,36.740567094845595
15,15,16,The effects of the saving outflow may thus have been felt disproportionately on U.S. interest rates and the dollar.,"The effects of the law will vary widely, and they may thus have been felt disproportionately on u.s. interest rates and the dollar.","The effects of the saving outflow may thus have been underestimated by the authors. they estimated the effect from savings by taking into account all the effects of inflation, saving and consumption,",The effects of the saving overflow may thus have been pronounced disproportionately on u. s. interest rates and the dollar.,0,2,True,True,False,57.32036590576172,46.361778259277344,158.55152893066406,63.477088928222656,0.2434782608695652,1.017391304347826,0.1391304347826087,12.0,37.0,5.0,16.602896049178536,13.800383354663817,24.81524534566266,26.899934416948586,24.739612975090495,35.53300407220397
16,16,17,"Also, in the view of a number of participants, the economy was possibly producing in the neighborhood of its potential, and the persistent strength in spending of late suggested that resource markets could tighten further and inflation pressures build.","Also, in the view of a number of participants, the the economy was possibly producing in the neighborhood of its potential, and the persistent strength in spending of late suggested that resource markets could tighten further and inflation pressures build.","Also, in the view of a number of participants, the economy was possibly producing in the neighborhood of its potential. it was hard to tell what that could translate into.

""the economy in china was still not growing fast","However, in the view of a number of participants, potential investment was possibly producing in the neighborhood of its potential, and the rise of economic activity of late suggested that resource markets could tighten up and inflation pressures build.",1,2,False,True,False,93.84455871582033,45.13127899169922,88.070068359375,87.79936981201172,0.0158730158730158,0.4087301587301587,0.2063492063492063,1.0,34.0,9.0,19.463583521196544,15.750528020532045,21.43355383855145,36.16927256797307,24.71664884141873,33.08160645070931
17,17,18,"Moreover, inflation was running at a fairly low rate and quite possibly would edge down a little further over coming quarters.","However, it was a legal ceremony and not a spiritual one.","Moreover, inflation was running at a fairly low rate and there were not that many other people to blame for it.

""if you're a small family and you're living","Moreover, inflation was running at a fairly low rate and gdp growth would slow down a bit further in coming quarters.",0,2,True,True,False,38.063743591308594,24.18086624145508,43.79894256591797,63.9155502319336,0.7142857142857143,0.5952380952380952,0.1984126984126984,29.0,34.0,9.0,14.431077616107208,22.65795232634997,20.42639361050119,24.107013899785425,28.72808782329374,33.491620970530654
18,18,19,"that is, the capacity utilization rate is lower than would have been expected, based on past experience, at the prevailing unemployment rate.","This is, the capacity utilization rate is lower than would have been expected, based on past experience, at the prevailing unemployment rate.","That is, the capacity utilization rate is lower than would have been expected given the size of the cohort; the difference is substantial and the magnitude of the difference is much larger than that observed","That is, the capacity and rate of investment thus would have been fixed, based on past experience, at the prevailing exchange rate.",0,2,False,True,False,41.92424774169922,18.03431510925293,43.52134323120117,35.44662094116211,0.0212765957446808,0.6950354609929078,0.2765957446808511,1.0,35.0,12.0,20.13441075083026,18.36531352955549,13.947638276359903,31.500253436804993,26.726188740741566,24.100188496939005
19,19,20,Hungary and Poland adopted inflation targeting following parliamentary acts stipulating that price stability was the main objective for the central bank.,"Hungary and poland adopted inflation targeting following parliamentary acts , that price stability was the main objective for the central bank.","Hungary and poland adopted inflation targeting following parliamentary acts stipulating that they should be measured in the currency used in the country (the lira).

the measures will be implemented from",Hungary and germany revised inflation projections following parliamentary acts stipulating that maximum employment was the primary objective for the central bank.,1,2,False,True,False,248.72227478027344,78.2491226196289,157.3666534423828,87.51472473144531,0.0784313725490196,0.5490196078431373,0.2483660130718954,4.0,36.0,10.0,19.22213008321911,15.9640791873299,26.353027059772465,27.224038517222436,24.95661403883707,37.11180166502004
20,20,21,"1 The longer-run projections represent each participant's assessment of the rate to which each variable would be expected to converge, over time, under appropriate monetary policy and in the absence of further shocks to the economy.","1 the short-lived-run projections represent each participant's assessment of the rate to which each variable would be expected to converge, over time, under appropriate monetary policy and in the absence of further shocks to the economy.",1 the longer-run projections represent each participant's assessment of the rate to which each variable would be expected to change by 2025. the more detailed projections for each participant reflect the individual participant's own estimates. this is not meant to,"Accordingly the longer - run forecast for the participant's assessment of inflation relative to gdp each month should be expected to converge, over time, under appropriate monetary policy and in the absence of further expansion of the economy.",2,1,False,False,True,47.14028549194336,41.43241882324219,81.35798645019531,41.43310928344727,0.043103448275862,0.4310344827586206,0.3017241379310345,2.0,35.0,25.0,22.745928421839853,19.92040342166531,23.392025791885715,38.29265378697726,34.98608061193902,35.587747978686416
21,21,22,And I fully expect it will return to solid growth and a solid labor market as well.,And i expect it will return to solid growth and a solid labor market as well.,"And i fully expect it will return to solid growth again over the next year or two.

in other words, the price of bitcoin could climb much higher in the coming",And i fully expect it will return to solid growth and a solid labor shortage as well.,2,1,True,True,True,89.6512222290039,23.43103408813477,122.24193572998048,64.54647827148438,0.0843373493975903,1.108433734939759,0.0963855421686747,3.0,35.0,4.0,18.590091299305257,19.289755276475976,22.04434833252113,30.5177574651391,29.697502609054286,30.366225874902895
22,22,23,"However, other measures of labor utilization--including the labor force participation rate and the numbers of discouraged workers and those working part time for economic reasons--suggested more modest improvement, and other indicators of labor demand, such as rates of hiring and quits, remained low.","However, other measures of labor utilization--including the labor force participation rate and the numbers of discouraged workers and those working part time for economic reasons--suggested more modest improvement, and other indicators of labor demand, such as rates of hiring, remained low.","However, other measures of labor utilization--including the labor force participation rate and the numbers of discouraged workers and those working part time--have also shown a drop. the percentage of the employed aged 18-54, for example, has declined to 62","However, other measures of labor utilization - - including the labor force participation rate and the numbers of discouraged workers and those working part time for economic reasons - - suggested more modest improvement, and other indicators of labor demand, such as rates of hiring and quits, remained low.",2,0,True,True,True,24.98324584960937,21.53582191467285,32.06609344482422,26.635093688964844,0.0332225913621262,0.3521594684385382,0.0199335548172757,2.0,37.0,4.0,22.810512105323607,17.975322903983262,21.402463260954857,31.82788158016493,28.51680180167671,31.140583926441664
23,23,24,"The productivity boom after the Civil War resulted from a variety of technological advances, including the expansion of and improvements in the use of steam power, railroad transportation, and communication by telegraph.",The productivity of matthew was a lot better than steven because matthew was a lot less productive in the civil war.,"The productivity boom after the civil war resulted from a variety of technological advances, including the printing press and the telegraph, which facilitated communication.

the industrial revolution that began in 1849 was driven by new","The productivity boom after the civil war resulted from a variety of technological advances, including the expansion of and improvements in the use of steam power, railroad transportation, and communication by telegraph.",2,0,False,False,True,75.69193267822266,21.59051322937012,27.84994888305664,21.626651763916016,0.6909090909090909,0.4681818181818182,0.009090909090909,47.0,38.0,3.0,20.343741932787708,17.159242294518233,18.738178854236114,34.898635201110956,32.79470830296947,34.73908389011338
24,24,25,"But if the economy instead began to overheat, threatening to push inflation to an undesirably high level, the FOMC would have ample scope to respond through tighter monetary policy.","If the economy began to overheat, the dollar began to overheat, and the fed would have to raise interest rates to keep the economy growing.","But if the economy instead began to overheat, threatening to push inflation to an all-time high, there were plenty of ways to save.

first there was the federal reserve. inflation-","But if the fed instead issued a fs directive, threatening to push inflation to its undesirably high level, the fomc would have ample scope to respond through tighter monetary policy.",1,2,False,False,False,18.972862243652344,33.16469192504883,140.86749267578125,33.35577774047852,0.56353591160221,0.43646408839779,0.1712707182320442,35.0,26.0,13.0,20.38549775671755,22.67125651526517,19.854595282925043,39.67795240779093,38.272714660158876,37.42827552027648
