,Unnamed: 0,id,factual,polyjuice,pplm,relitc,label,target,polyjuice_success,pplm_success,relitc_success,polyjuice_perplexity,pplm_perplexity,relitc_perplexity,factual_perplexity,polyjuice_edit_distance,pplm_edit_distance,relitc_edit_distance,polyjuice_tree_edit_distance,pplm_tree_edit_distance,relitc_tree_edit_distance,polyjuice_embedding_distance,pplm_embedding_distance,relitc_embedding_distance,polyjuice_implausibility,pplm_implausibility,relitc_implausibility
356,360,361,"That should gradually return the economy to full utilization of its resources, while inflation remains subdued.","That should gradually return the economy into full utilization of its resources, while inflation remains subdued.","That should gradually return the economy to full utilization of resources by the time it is over.

in other words, the economy should be able to handle the increase in demand","That should gradually return the economy to full utilization of its resources, where inflation remains subdued.",0,1,True,True,True,120.36856079101562,34.1148567199707,113.6881866455078,91.12566375732422,0.018018018018018,0.7747747747747747,0.018018018018018,2.0,30.0,2.0,24.465207629605363,22.03708104469241,23.869496402909583,31.367574433297836,29.23806423721321,33.79923871675261
357,361,362,"The pace of real GDP growth was forecast to be faster over the second half of this year than in the first half, primarily reflecting a modest increase in the rate of growth of private domestic final purchases and a sizable turnaround in inventory investment.","The pace of real gdp growth was forecast to be faster over the second half of this year than in the first quarter, primarily reflecting a modest increase in the rate of growth of private domestic final purchases and a sizable turnaround in inventory investment.","The pace of real gdp growth was forecast to be faster over the second half of this year than in the first half of 2015, according to a survey of analysts.

the survey, conducted by the bank of japan's main credit","The pace of real gdp growth was forecast to be faster over the second half of this year than in the first half, primarily reflecting a modest increase in the rate of growth of private domestic final purchases and a sizable turnaround in inventory investment.",1,0,False,False,True,33.66466522216797,21.64675521850586,32.96405792236328,26.2071475982666,0.0348837209302325,0.4496124031007752,0.0116279069767441,4.0,37.0,3.0,22.397487531683492,22.012491031479275,21.21978386184006,34.2604860099924,34.74631261653689,33.567309485328735
358,362,363,"Looking ahead, FOMC participants project the unemployment rate to continue to decline; the median projection is 5 percent at the end of next year and moves below 4 percent by 2023.","Meanwhile, fomc participants in new york, san francisco, and monterey, california are working on a critical anthology of neo-latin texts.","Looking ahead, fomc participants project the unemployment rate to continue to decline; the median projection is 4.2 percent in october from 4.5 percent in september.

however, the unemployment rate remains below where","Looking ahead, fomc participants project the unemployment rate to continue to decline ; the median projection is 5 percent at the end of this term and moves to 4 percent by 2023.",2,0,False,True,True,96.05329895019533,40.62562561035156,59.492923736572266,31.56013298034668,0.7055555555555556,0.4222222222222222,0.0888888888888888,46.0,27.0,5.0,18.390150216261876,20.331203599455865,21.02839014411733,36.329608157120454,28.674384511494495,30.377121422032886
359,363,364,"Although growth in output and employment slowed during the first quarter, the Committee continues to expect that, with appropriate policy accommodation, economic activity will expand at a moderate pace, with labor market indicators continuing to move toward levels the Committee judges consistent with its dual mandate.","Although growth in output and employment slowed during the first quarter, the committee continues to expect that, with appropriate policy accommodation, economic activity will expand at a moderate pace, with labor market indicators continuing to move toward levels the committee judges consistent with its medieval mandate.","Although growth in output and employment slowed during the first quarter, the committee continues to expect that, with appropriate policy accommodation, economic activity will remain strong for the remainder of 2012. we estimate that output and employment are likely to remain strong, as the current level","Although growth in output and employment slowed during the first quarter, the committee continues to expect that, with appropriate policy accommodation, economic activity will expand at a moderate pace, with labor market indicators continuing to rise toward levels the committee considers consistent with its dual mandate.",0,1,False,True,True,47.6880111694336,27.756336212158203,34.76121520996094,36.92523193359375,0.0219435736677116,0.335423197492163,0.0376175548589341,7.0,36.0,6.0,30.47445087395858,26.424376921709825,28.535147696448348,45.04783185099063,33.992236181502875,42.195771816298056
360,364,365,I'm old enough to remember what very high inflation was like.,I’m old enough to remember what very high inflation is like.,"I’m old enough to remember what very high inflation was like in the early 1980's. the fed was running a huge amount of money out of town, and inflation was running very",I'm old enough to remember what very high inflation feels like.,2,1,True,True,True,153.65017700195312,47.38585662841797,45.59793472290039,33.49174880981445,0.0491803278688524,1.7704918032786885,0.0655737704918032,3.0,42.0,3.0,24.976021288385564,21.32796567736477,23.49772181643963,30.721518804387486,29.232229272198467,31.375710662094253
361,365,366,"The U.S. economy is in a good place, and we will continue to use our monetary policy tools to help keep it there.","The u.s. economy is not a good place, and we will continue to use our monetary policy tools to help keep it there.","The u.s. economy is in a good place, and we will continue to grow and create jobs. but our economy is not perfect. we are making progress but we need to continue to improve","The u. s. economy is in a good place, and we will continue to need better monetary policy tools to help keep employment there.",1,0,True,True,True,20.3346004486084,12.576621055603027,33.6347541809082,9.832613945007324,0.0442477876106194,0.7699115044247787,0.1769911504424778,5.0,37.0,9.0,25.47419703697793,22.857706628196016,25.556299913572992,31.073742369179964,32.21039357407799,35.318335940538994
362,366,367,"The drop in the unemployment rate over the past year, while welcome and significant, could overstate the degree of improvement in labor market conditions, in part because of the decline in the labor force participation rate.","The drop in the unemployment rate over the year, while welcome and significant, could overstate the degree of improvement in labor market conditions, in part because of the decline in the labor force participation rate.","The drop in the unemployment rate over the past year, while welcome and significant, could overstate the degree of joblessness for a period of time. the labor market is still a long way from full employment, as the labor force","The drop in the unemployment rate over the past year, while welcome and significant, could overstate the degree of improvement in labor market conditions, in part because of the decline in the labor force participation rate.",2,0,True,True,True,15.902663230895996,18.2498722076416,13.189204216003418,13.189204216003418,0.0223214285714285,0.3973214285714285,0.0,1.0,31.0,0.0,18.71810573417764,17.51427464074742,20.17501201933504,29.73439286053391,29.773634169156956,29.651129515572745
363,367,368,"I think we all agree that the economy is making progress, that we are close to an unemployment rate that is one that's sustainable in the longer run.","However, that the economy is making progress, that we are close to an unemployment rate that is one that is not sustainable.","I think we all agree that the economy is making progress, that we are making progress, but that progress is not what we need right now. there isn't much progress. we don't have enough","I think we all agree that our economy is making progress, that we are close to an unemployment rate that is one that's sustainable in the longer run.",1,0,True,True,True,30.553693771362305,12.087063789367676,19.90781593322754,18.75517845153809,0.2751677852348993,0.5503355704697986,0.0201342281879194,17.0,36.0,2.0,20.918880781079064,23.726619875093235,24.075886673983423,28.737394417495196,31.084295579524632,30.85337082033864
364,368,369,"The Committee expects that, with further gradual adjustments in the stance of monetary policy, economic activity will expand at a moderate pace in the medium term and labor market conditions will remain strong.","The committee expects that, with further gradual adjustments in the stance of monetary policy, economic activity will expand at a moderate level in the medium term and labor market conditions will remain strong.","The committee expects that, with further gradual adjustments in the stance of monetary policy, economic activity will begin to recover from the global slowdown that began with the start of the financial crisis. we expect further improvement in the outlook","The committee expects that, with further gradual adjustments in the stance of monetary policy, economic activity will expand at a moderate pace in the medium term and labor market conditions will remain strong.",1,0,True,True,True,27.229248046875,25.431507110595703,23.55854797363281,22.758066177368164,0.0238095238095238,0.4904761904761904,0.0047619047619047,3.0,35.0,2.0,24.49014754746224,23.20785523859737,24.89328054045587,32.67789067541433,32.17636138767,32.871606198148626
365,369,370,"But the members generally were concerned that inflation might begin to rise over the intermediate term, especially if labor markets tightened further.","But the members generally were concerned that inflation might begin to rise over the intermediate term, especially if labor markets were tightened further.","But the members generally were concerned that inflation might begin to creep upward and lead to a crash.

the group said: ""the government should not allow the inflation to become a","But the members generally were concerned that productivity might begin to rise over the intermediate term, especially if labor markets tightened further.",1,0,False,False,True,66.66844940185547,35.922828674316406,80.50670623779297,67.46358489990234,0.0333333333333333,0.5733333333333334,0.0666666666666666,3.0,32.0,1.0,29.439388475488663,25.88189185449864,24.37694788651612,42.68660257234854,36.159645573931314,31.84566696103582
366,370,371,"Signs of an actual change in inflation were still quite tentative and anecdotal, and they did not warrant an adjustment to policy at this meeting.","Signs of an actual change in inflation were still quite tentative and anecdotal, and they often did not warrant an adjustment to policy at this meeting.","Signs of an actual change in inflation were still quite tentative and had not been confirmed as recently as february 2017, but since then, they have been more apparent. since early december 2016,","Signs of an actual change in inflation were generally quite tentative and remained somewhat above normal, and they did not warrant any adjustment to policy at this meeting.",2,1,False,True,True,85.04164123535156,41.97751998901367,85.91923522949219,82.68034362792969,0.0410958904109589,0.6643835616438356,0.2123287671232876,1.0,36.0,9.0,19.67022942260906,20.056027854518693,22.965509330080543,35.94103470848863,28.650522129526074,31.562785441990496
367,371,372,"Subsequently, investors revised down the expected policy path after the June employment report and the Chairman's semiannual monetary policy testimony.","Subsequently, investors revised down the expected policy path in response to the june employment report and the chairman's semiannual monetary policy testimony.","Subsequently, investors revised down the expected policy path after the fed began raising rates and investors saw signs of further price appreciation.

but the fed's decision to start the rate increase","Subsequently, inflation revised toward the expected policy path through the june employment outlook and the chairman's semiannual monetary policy testimony.",0,1,False,True,True,124.43926239013672,94.5886688232422,221.1034393310547,135.1493682861328,0.0993377483443708,0.6556291390728477,0.1655629139072847,8.0,35.0,11.0,24.38156982401567,24.82858334812652,21.171039176449653,38.78990417889425,30.626976042892892,31.672333492165652
368,372,373,We're looking at wages and we're looking at ultimately inflation.,"We're looking at wages and income, we're looking at ultimately inflation.","We're looking at wages and we're looking at ultimately inflation.

so i've been talking with a lot of people. i think it's a lot different now than when we started",We're looking at wages and we're looking at raising inflation.,2,1,False,False,True,65.2391128540039,25.54633903503418,49.86628723144531,76.70802307128906,0.123076923076923,1.5076923076923077,0.1384615384615384,3.0,40.0,4.0,17.64793630825505,20.79074387931248,20.34653447094497,33.114684217122864,38.3027406003608,27.95271263080562
369,373,374,"So on the first, the Committee's forecasts and those of most outside forecasters do show growth running below its longer-run potential this year and next year.","So on the first, the committee’s forecasts suggest and those of most outside forecasters do show growth running below its longer-run potential this year and next year.","So on the first, the committee’s forecasts and those of most outside forecasters, the forecast for the united states for 2017 is a moderate decline. this will be a modest decline of 2.4 percent","So on the first, the committee's forecasts and those of most outside the countries do show inflation running above its longer - run objective next year and next year.",0,1,False,False,True,175.05389404296875,87.68071746826172,168.4221954345703,90.87737274169922,0.0628930817610062,0.5408805031446541,0.2264150943396226,7.0,41.0,15.0,26.81185493306852,23.898706270486773,15.776271390560222,37.50032339955872,35.658039207741496,26.968042839259873
370,374,375,"This lack of congressional momentum could be interpreted as lack of congressional support for inflation targeting, or it could merely reflect a more neutral absence of strong opinions.","This lack of congressional momentum could be interpreted as lack of congressional support for a fiscal consolidation plan, or it could merely reflect a more neutral absence of strong opinions.",This lack of congressional momentum could be interpreted as lack of congressional support for the president's executive orders. as the president himself has said he will not be issuing a single executive order during his first 100,"This lack of congressional momentum could be interpreted as lack of congressional support for inflation targeting, or it could merely reflect the more neutral absence of strong opinions.",2,0,False,False,True,61.15452194213867,26.65562057495117,94.44651794433594,86.26732635498047,0.108695652173913,0.5543478260869565,0.0163043478260869,6.0,34.0,1.0,17.26240477082644,21.84417242918888,16.112349331593453,32.75977996706574,33.3655779024153,34.06525711227946
371,375,376,It would consist of inflation plus-plus productivity growth.,Empty would consist of a number plus productivity growth.,It would consist of inflation plus—plus productivity growth. the government would also need to add more money to the economy to cover all the additional costs of paying people back their student loans,Inflation would consist of sustained plus - plus productivity growth.,2,1,False,True,True,764.1385498046875,46.92243957519531,306.7860412597656,165.48728942871094,0.2833333333333333,2.35,0.2833333333333333,5.0,40.0,9.0,17.456748205782386,29.11037905022765,24.124201333246784,32.69932345747804,34.7633801253005,30.26219459312841
372,376,377,"And we're learning to, to engage in economic activity.",Empty we learn to engage in economic activity.,"And we’re learning to, to engage in economic activity.

in my view, our nation's current economic crisis is a product of the policies of both parties.

for","And we're learning to, to engage in economic easing.",2,0,False,True,True,597.0960083007812,53.13492202758789,208.7288055419922,105.33894348144533,0.2777777777777778,1.8888888888888888,0.1296296296296296,7.0,37.0,1.0,16.53107996503111,23.41936913324446,23.17831113611828,33.03308134465448,31.274741453495395,34.26917021840947
373,377,378,"To be sure, our main tool, monetary policy, is a blunt instrument that cannot be targeted at individual industries or regions.","To be sure, our main tool, monetary policy, is a blunt instrument that cannot be interpreted at individual industries or regions.","To be sure, our main tool, monetary policy, is a very complex, complicated and difficult problem to solve.

the fed can raise interest rates if they decide to, or they","To be sure, our monetary policy, too flexible, will be an instrument that can be targeted at individual businesses or households.",2,1,False,True,True,54.64836502075195,33.16317367553711,50.85701370239258,38.44398880004883,0.0396825396825396,0.7063492063492064,0.3968253968253968,1.0,33.0,14.0,18.18782024238842,27.045501756814566,26.931938624353627,36.671934538873664,40.35218496055656,33.82164853897669
374,378,379,"Inflation continued to run below the Committee's longer-run objective, held down in part by the effects of declines in energy and non-energy import prices.","Inflation continued to run below the committee's longer-run objective, held down in part by the effects of declines in energy consumption, and non-energy import prices.","Inflation continued to run below the committee's longer-run objective, held down in september by the weakening of the dollar and the impact of weaker commodity prices. the committee decided to raise the federal funds rate by","Inflation continued to run above the committee's longer - run objective, held down in part by the effects of declines in energy and non - energy import prices.",0,1,False,True,True,41.15370559692383,31.09562873840332,82.29385375976562,36.15603256225586,0.0903225806451612,0.6774193548387096,0.064516129032258,5.0,33.0,13.0,21.7032503831063,22.367225534494235,21.57623857789518,35.40927601347589,31.619446279707027,28.793568476806286
375,379,380,"Indeed, consumer expenditures appeared to have been expanding moderately over the previous few months, buoyed by increases in employment, personal income, and household wealth.","Indeed, consumer prices appeared to have been expanding moderately over the previous few months, buoyed by increases in employment, personal income, and household wealth.","Indeed, consumer expenditures appeared to have been expanding moderately over the previous quarter. consumer spending rose 1.9% in june compared with the previous year, and the pace is expected to grow further","Indeed, consumer expenditures appeared to have been expanding moderately over the previous few weeks, buoyed by increases in employment, personal income, and household wealth.",2,1,True,True,True,27.5645751953125,33.35013198852539,31.21273422241211,29.14384078979492,0.0454545454545454,0.5,0.0284090909090909,1.0,34.0,1.0,15.204834375680134,16.783470412585103,17.688682010976468,29.353062406227618,27.307279868654255,28.994371915455275
376,380,381,"With about $250 billion of these inflation-protected securities now outstanding, we can get readings along the entire maturity structure of real interest rates.","With about $16 billion of these inflation-protected securities now outstanding, we can get readings along the entire maturity structure of real interest rates.","With about $250 billion of these inflation-protected securities now outstanding, we expect the market cap to rise again over the next few years as investors seek to reduce their risks.

as a result","With about $ 250 billion of these inflation - protected securities now outstanding, we can get readings along the entire maturity structure of real interest rates.",2,0,False,True,True,105.95206451416016,24.912466049194336,380.1925048828125,112.37220001220705,0.01875,0.49375,0.01875,1.0,34.0,4.0,19.52438142405059,22.65425443246906,20.3986022602927,35.805829381162496,31.5221224110621,34.898573258563
377,381,382,"The staff viewed the uncertainty around its December projections for real GDP growth, the unemployment rate, and inflation as similar to the average of the past 20 years.","The staff viewed the uncertainty around its december projections for real gdp growth, the unemployment rate, and inflation as only similar to the average of the past 20 years.","The staff viewed the uncertainty around its december projections for real gdp growth, the unemployment rate and inflation and came to the conclusion that they needed a more aggressive fiscal policy stance. it is not unusual for governments","The staff viewed the growth around the december 10 meeting and found unemployment, fast growths, and inflation rates similar to the average of the past 20 years.",2,1,False,True,True,87.40804290771484,60.66307830810547,93.83748626708984,43.32755279541016,0.0529411764705882,0.5588235294117647,0.3235294117647059,6.0,34.0,19.0,20.80095117882448,25.42503231800401,16.79332555251422,38.16517107681893,31.842893369062338,29.266843501974098
378,382,383,"Indeed, over the past century, by far the smallest part of the growth in America's real gross domestic product reflects increased physical product measured in bulk or weight.","Indeed, over the past century, by far the smallest part of the growth in the united kingdom's real gross domestic product reflects increased physical product measured in bulk or weight.","Indeed, over the past century, by far the smallest part of the growth in the world economy has been in technology.

the number of people working in the tech industry grew from 6.4 million","Moreover, over the past century, by far the greater part of the increase in america's real gross domestic product reflects increased physical product measured in bulk or consumption.",2,1,False,False,True,57.88812255859375,13.239222526550291,53.97206878662109,48.60338592529297,0.0919540229885057,0.5402298850574713,0.1781609195402299,4.0,36.0,6.0,18.225214374286303,16.382187424597003,21.70970222636213,33.56162496174377,33.184016833743115,30.539282084438486
379,383,384,An easing of supply constraints was expected to support continued gains in economic activity and employment as well as a reduction in inflation.,An easing of supply constraints was expected to support continued gains in economic output and employment as well as a reduction in inflation.,"An easing of supply constraints was expected to support continued gains in the uk's gdp.

a report published on friday said the bank of england was expecting gdp to rise by a",An easing of supply shortages was expected to support continued gains in economic activity and employment as well as a reduction in inflation.,2,1,True,True,True,33.145023345947266,70.0659408569336,36.80054473876953,31.32084083557129,0.0416666666666666,0.5416666666666666,0.0555555555555555,1.0,36.0,1.0,22.349420537684523,19.212281278941035,22.990929670849297,30.43363966988847,29.028082980118306,30.518184064602252
380,384,385,Persistently strong demand and increasingly supportive conditions in debt and equity markets suggested the possibility of rising inflation pressures.,Persistently strong demand and increasingly supportive conditions in debt terms and equity markets suggested the possibility of rising inflation pressures.,"Persistently strong demand and increasingly supportive conditions in debt and equity markets, with a growing market for both high yielding and highly leveraged debt, are pushing yields up and down to new",Persistently strong demand and increasingly supportive conditions in debt and equity markets suggested the possibility of reduced inflation pressures.,1,0,False,True,True,169.00439453125,50.82556915283203,176.9217987060547,152.8981170654297,0.0402684563758389,0.5906040268456376,0.0402684563758389,1.0,30.0,4.0,29.238170656103804,20.327504294708746,18.44742546282114,41.89760189828633,30.419080544425245,28.665953556315184
381,385,386,"Overall inflation was projected to remain subdued, with the staff's forecasts for headline and core inflation little changed from the previous projection.","Overall inflation was projected to remain subdued, with the staff's forecasts for headline and core inflation little changed from the previous one projection.","Overall inflation was projected to remain subdued, with the staff's forecasts rising to 2% from 2.1%, and nominal growth being revised up to 1.3%, from a low of 1","Overall inflation was forecast to remain subdued, but the staff's forecasts for headline and core inflation had changed from the previous year.",0,1,False,False,False,91.28557586669922,24.939254760742188,63.23667526245117,73.29212188720703,0.0259740259740259,0.448051948051948,0.1558441558441558,3.0,31.0,7.0,21.551777946414795,20.555324037158307,24.365579477923323,37.79959568597745,33.322638473359206,41.915207441024634
