,Unnamed: 0,id,factual,polyjuice,pplm,relitc,label,target,polyjuice_success,pplm_success,relitc_success,polyjuice_perplexity,pplm_perplexity,relitc_perplexity,factual_perplexity,polyjuice_edit_distance,pplm_edit_distance,relitc_edit_distance,polyjuice_tree_edit_distance,pplm_tree_edit_distance,relitc_tree_edit_distance,polyjuice_embedding_distance,pplm_embedding_distance,relitc_embedding_distance,polyjuice_implausibility,pplm_implausibility,relitc_implausibility
243,246,247,"If this high-pressure management inadvertently carried the economy beyond its productive potential, some cost in terms of inflation could be expected,","If this high-pressure management inadvertently carried the economy beyond its productive potential, some cost in terms of higher energy consumption could be expected,","If this high-pressure management inadvertently carried the economy beyond its limits, that could have cost us dearly. inflation, which was at its highest level in decades, was already running at","If this high - pressure management inadvertently extended the economy beyond its productive potential, some cost in terms of inflation could be expected,",2,1,True,True,True,103.25023651123048,50.39689254760742,179.8487548828125,107.76075744628906,0.1266666666666666,0.58,0.0533333333333333,4.0,34.0,7.0,17.982982014068092,21.24685283554173,17.53321189270272,27.860563085316535,32.88860552859128,27.13801026041915
244,247,248,"At the conclusion of the discussion, the Committee voted to authorize and direct the Federal Reserve Bank of New York, until it was instructed otherwise, to execute transactions in the System Account in accordance with the following domestic policy directive: The Federal Open Market Committee seeks monetary and financial conditions that will foster price stability and promote sustainable growth in output.","At the end of the discussion, the committee voted to reauthorize the bank of the united states in 1987, to the credit of the united states postal service and to the credit of the united states federal government.","At the conclusion of the discussion, the committee voted to authorize and direct the federal reserve bank of new york, until it was instructed otherwise, to execute transactions in the bitcoin currency as follows:

(a) at the request of a member bank, the board of governors of the federal","At the conclusion of the discussion, the committee voted to authorize and direct the federal reserve bank of new york, until it was instructed otherwise, to execute transactions in the system bank in accordance with the following domestic policy commitments : the federal open market committee seeks monetary and financial conditions that will foster price stability and promote sustainable growth in output.",1,2,True,True,False,16.12164306640625,22.85138893127441,64.4796371459961,29.819414138793945,0.6397058823529411,0.4289215686274509,0.0686274509803921,77.0,59.0,25.0,14.413963350387828,18.57319312360634,36.89647850986813,24.91049037303372,26.687365136508873,39.714135229437055
245,248,249,"The slower growth of final spending resulted in inventory overhangs in a number of industries, most notably those related to the motor vehicle sector.","The slower growth of final spending resulted in the closure overhangs in a number of industries, most notably those related to the motor vehicle sector.","The slower growth of final spending resulted in inventory overhangs in a variety of industries, but also increased the cost burden for taxpayers.

according to a study by deloitte, the","The slower growth in household spending and rising inventory overhangs reflects a number of factors, most notably inflation risks to the global service sector.",2,1,False,True,True,54.086795806884766,54.17813491821289,79.31021118164062,57.68036651611328,0.06,0.48,0.3933333333333333,4.0,23.0,23.0,22.53177627017329,21.35685872603648,20.882936370248885,36.48344800196508,29.425384175430885,30.56504701093843
246,249,250,"Consumer price inflation continued to run below the Committee's longer-run objective of 2 percent, restrained in part by earlier decreases in energy prices and in prices of non-energy imports.","Consumer price inflation continued to run below the committee's longer-run objective of 2 percent, restrained in part by earlier decreases in energy prices and higher prices of non-energy imports.","Consumer price inflation continued to run below the committee's longer-run objective of 2 percent, with the consumer price index (cpi) inflation rate at 3.9 percent in april from 3.9 percent in march","The unemployment rate continued to run below the committee's longer - run objective of 2 percent, restrained in part by earlier increases in interest rates and in prices of non - imported imports.",0,1,False,True,True,30.20488166809082,25.265220642089844,85.9443588256836,30.511079788208008,0.03125,0.3958333333333333,0.2135416666666666,4.0,33.0,20.0,18.848601880694453,23.063322287088027,24.79722598249032,33.758838922762614,30.56924410947324,35.48387386502723
247,250,251,"In fact, the low funds rate has been necessary to promote growth that, to date, has been just sufficient to begin reducing substantial margins of slack in resource utilization.",Empty low rates has been necessary to promote growth that has been empty sufficient to begin empty substantial offsetting.,"In fact, the low funds rate has been necessary to promote growth that, to date, the country has not had. and it has had some of the most rapid growth. the economy grew faster than expected","In fact, the low funds rate has been necessary to promote growth that, to date, has been just sufficient to begin reducing the margins of slack in resource supply.",0,1,True,True,True,452.28851318359375,33.84541702270508,74.58509826660156,87.3901596069336,0.4090909090909091,0.5056818181818182,0.1136363636363636,36.0,29.0,2.0,24.36027424902584,26.649008012071192,25.89933750201467,33.366491514140655,35.06654898682283,36.2666123394897
248,251,252,"The several extensions of emergency unemployment insurance benefits appeared to have raised the measured unemployment rate, relative to levels recorded in past downturns, by encouraging some who have lost their jobs to remain in the labor force.",Several extensions of the london congestion charge were withdrawn in 2007( and introduced on 1 january 2011).,"The several extensions of emergency unemployment insurance benefits appeared to have raised the measured unemployment rate, relative to other states that have adopted such benefits, from 6.5 percent to 7.1 percent in september, according to data released","The several extensions of the unemployment insurance benefits appear to have boosted the measured inflation rate, relative to levels recorded in past great recessions, by encouraging some who have lost their jobs to remain in the labor force.",0,1,False,False,True,286.763671875,24.97547912597656,39.02378845214844,45.83597183227539,0.7346938775510204,0.3714285714285714,0.1428571428571428,54.0,36.0,8.0,18.665413341214663,27.704626371708965,25.9892950181656,33.1903400935421,34.10528259667866,34.471684550941944
249,252,253,"Treasury bond yields declined somewhat, perhaps reflecting both expectations of lower policy rates and greater investor demands for safety.","However, the bond yields declined somewhat, perhaps reflecting both expectations of lower policy rates and greater investor demands for safety.","Treasury bond yields declined somewhat, perhaps reflecting both expectations of further growth in business investment and the expectations that the federal reserve will begin raising interest rates soon.

the yield on the","Treasury bond yields declined somewhat, perhaps reflecting both expectations of higher policy rates and greater investor demands for safety.",0,1,False,True,True,79.03167724609375,30.108997344970703,78.7452621459961,76.76155853271484,0.079136690647482,0.7841726618705036,0.0287769784172661,3.0,31.0,1.0,23.412596822173423,24.140792173419893,23.312899214765352,34.88043891693652,29.700039909984028,31.477418833813175
250,253,254,"Moreover, if, as some members thought likely, productivity growth slowed as employment picked up, the result could be reductions in slack accompanied by higher unit labor costs and associated pressures on prices.","In other words, if, as some theorists think, a state similar in culture and preferences to the old hegemon will assume new hegemon status and become a threat to the traditional hegemon.","Moreover, if, as some members thought likely, productivity growth slowed as employment picked up, the result would be an overall increase in tax revenue of around £2.5 billion a year, but with the tax burden falling on","Moreover, if, as some members thought likely, productivity rose further as employment picked up, the committee could achieve reductions in slack accompanied by lower unit labor costs and associated pressures on prices.",1,2,True,True,False,33.71403884887695,24.31743621826172,100.69756317138672,63.92393112182617,0.7264150943396226,0.3773584905660377,0.1320754716981132,51.0,31.0,7.0,18.0662839163874,18.006910889575934,27.676928531285817,27.111566770352216,27.107254493773745,39.22557020353047
251,254,255,"Indeed, how will we measure inflation, and the associated financial market implications, in the twenty-first century when our data--using current techniques--could become increasingly less adequate to trace price trends over time?","Clearly, how will we measure inflation, and the associated financial market effects, in the twenty-first century when our country's macroeconomic policies are most in tune to demand.","Indeed, how will we measure inflation, and the associated financial market implications, in the twenty-first century? it is hard to imagine any of this.

the federal reserve does have a great deal of authority, but","So, how will we measure inflation, and the associated financial market implications, in the twenty - first century when our data - - using current techniques - - could become increasingly less adequate to trace price trends over time?",2,0,False,False,True,40.1088981628418,33.31141662597656,89.20539093017578,63.84689331054688,0.4043478260869565,0.3782608695652174,0.0608695652173913,25.0,31.0,11.0,16.300974890657162,15.86064578991477,16.693066988903475,37.5364000666616,33.79778848218194,35.58415768376703
252,255,256,"To measure productivity and standards of living we need measures of output but, to measure output, we need to be able to define products clearly and in terms of units that do not change from one period to the next.","To measure productivity and standards of living we need measures of output but, to measure output, we need to be able to define products clearly and in terms of unit of units that do not change from one period to the next.","To measure productivity and standards of living we need measures of output but, to measure output, we need to be able to measure output. if output is measured by a number such as the number of hours worked, then output will measure productivity","To measure productivity and standards of living we need measures of output but, to measure output, we need to be able to define products clearly and in terms of units that don't change from one period to the next.",2,0,False,False,True,26.78424835205078,19.85237693786621,26.341327667236328,25.55059814453125,0.0373831775700934,0.4299065420560747,0.0093457943925233,4.0,39.0,1.0,14.293985008562236,17.59619663305519,14.568639377835366,34.48687750622584,37.29484626917777,35.014311263213074
253,256,257,"For example, changes in U.S. short-term interest rates seem to exert a substantial influence on euro area bond yields (Ehrmann, Fratzscher, and Rigobon, 2005","For example, changes in the u. s. direction seem to exert a substantial influence on euro area bond yields (ehrmann, fratzscher, and rigobon, 2005).","For example, changes in u.s. short-term interest rates seem to exert a positive feedback effect on the economy, with firms seeking to reduce costs and raise earnings. that may explain why companies are so eager","In particular, changes in u. s. longer - term interest rates seem to have had a substantial influence on demand on crop yields ( higher oil prices, a decline in productivity, price fobs, and",2,1,False,False,True,97.04398345947266,34.4838981628418,85.33573150634766,38.62589263916016,0.1910828025477707,0.7006369426751592,0.5859872611464968,12.0,38.0,35.0,19.570074315229665,20.61738984119624,19.95821698564298,33.87945373163761,31.907394220143075,32.456689612964894
254,257,258,Some participants also noted that recent readings on some survey measures of consumers' inflation expectations had declined or stood at historically low levels.,"However, also noted that recent readings on some survey measures of consumers' inflation expectations had declined or stood at historically low levels.","Some participants also noted that recent readings on some survey measures showed significant declines during the 1970s and 1980s.

the authors noted that some of the declines may be linked to",Some participants also noted that their readings on some survey measures of consumers'inflation expectations had declined or stood at historically elevated levels.,0,1,False,False,True,75.03441619873047,29.70306968688965,104.67276000976562,70.2857894897461,0.0875,0.5625,0.08125,2.0,32.0,7.0,20.878631540188763,19.43729457059176,22.37034955688141,33.77106076997887,34.127916390656694,31.904493470195852
255,258,259,"To keep the experiments as clean as possible, I assume that the economy begins at full employment and with both headline and core inflation at desired levels.","To keep the experiments as clean as possible, i suggest that the economy be charted and indexed.","To keep the experiments as clean as possible, i assume that the economy will be kept stable. if it is not, i'll assume it will be. that is, i'll keep it simple","To keep the experiments as clean as possible, i assume that the economy begins at full employment and with both headline and core inflation above desired levels.",2,0,False,False,True,69.9253921508789,26.782575607299805,80.84832000732422,65.64502716064453,0.4683544303797468,0.4493670886075949,0.0316455696202531,24.0,41.0,4.0,16.397209440874928,19.45910450259027,21.750642526248587,35.80556737093289,34.20662893515002,36.43938434379752
256,259,260,"November 19, 2021 Perspectives on Global Monetary Policy Coordination, Cooperation, and Correlation Vice Chair Richard H. Clarida At the ""Macroeconomic Policy and Global Economic Recovery"" 2021 Asia Economic Policy Conference, sponsored by the Federal Reserve Bank of San Francisco Center for Pacific Basin Studies, San Francisco, California (via webcast) Share Watch Live In my remarks today, I would like to offer some perspectives on global monetary policy correlation and what it canand cannotreveal about the prevalence and value of global monetary policy coordination or, in the limit, binding global monetary cooperation.1 In both the Global Financial Crisis (GFC) and the Global Pandemic Collapse (GPC), major central banks around the world responded by cutting policy rates to, and then keeping them at, their effective lower bounds (ELBs); by increasing their balance sheets through ambitious and expansive large-scale asset purchase and lending programs; and by offering forward guidanceboth Delphic and Odysseanon the stance of their future monetary policies.2 As these examples make clear, we certainly do observe that national monetary policies are often correlated, and such examples are not confined to recent experience.","However, however, however,","November 19, 2021 perspectives on global monetary policy coordination, cooperation, and correlation vice chair richard h. clarida at the ""macroeconomic policy and global economic recovery"" 2021 asia economic policy conference, sponsored by the federal reserve bank of san francisco center for pacific basin studies, san francisco, california (via webcast) share watch live in my remarks today, i would like to offer some perspectives on global monetary policy correlation and what it canâ€”and cannotâ€”reveal about the prevalence and value of global monetary policy coordination or, in the limit, binding global monetary policy to specific economic conditions. as with any discussion of monetary policy, the topic of correlation in macro-economic policy analysis is","In 2013, my views on global monetary policy expanded, and, at the closing of the u. s. congress for the "" pursuit of inclusive and sustainable economic recovery "" at a benefit auction event, sponsored by the federal reserve bank as part of their series of policy studies, i think, that ( as webcast ) in the course of my webcast, i would like to offer some perspectives on the monetary policy for you so it can further accreve itself with my views on the implications of monetary policy principles or, in the limit, binding global monetary policy. 9 as consequence of rising interest rates ( gws ) and lower suspected pandemic rates ( trrs ), major central banks around the world called for cutting policy rates to, and for keeping them at, levels with lower bounds ( ells ) ; for lowering the rates for their ambitious and expansive large - scale socialization and equity programs ; and for bringing forward naboth delany and ovid de slack in their stance toward influencing future monetary policies. 2 very few examples make clear, and also note explicitly that national monetary policies are often correlated, and such examples are not confined to recent experience.",0,1,False,False,True,66.52716827392578,67.89667510986328,104.37635040283205,47.93041229248047,0.9797898140662894,0.4535165723524656,0.4357316087308003,279.0,204.0,179.0,19.976990272831685,21.1242629007661,30.956471007886734,35.42941658671272,44.24209618986106,40.04345127457007
257,260,261,"The release this year and last of mortgage price data gathered under the Home Mortgage Disclosure Act (HMDA) has highlighted a different, but potentially related, concern about access to credit on equal terms.",The release this year and last of the extended mortgage repayment data collected under the fair pay act have highlighted a range of other problems with the process than with the hmmd.,The release this year and last of mortgage price data gathered under the home mortgage disclosure act (hmda) has raised questions about whether regulators and banks are doing enough to ensure mortgage prices stay below these historically low,"The release this week and december of home price data gathered under the home mortgage disclosure act ( hmda ) has highlighted a stronger, but potentially related, concern about access to credit on equal terms.",2,1,False,False,True,134.95477294921875,63.09077835083008,114.08636474609376,55.4276237487793,0.5598086124401914,0.507177033492823,0.1674641148325359,36.0,39.0,15.0,18.445707959503736,27.729857312849305,19.43401355440623,34.29826543088975,32.97165181824494,29.714056950124316
258,261,262,"Indeed, the proposed reduction in the nominal federal funds rate would about offset the apparent increase in the real federal funds rate stemming from a recent decline in inflation.","Indeed, the proposed reduction in the nominal federal funds rate would about offset the supposedly increase in the real federal funds rate stemming from a recent decline in inflation.","Indeed, the proposed reduction in the nominal federal funds rate would about offset the increase in the federal funds rate, but in the short run a further reduction by the federal funds rate is not likely to have","Indeed, the proposed reduction in the real federal funds rate would about offset the apparent increase in the real federal funds rate stemming from the recent decline in deposits.",0,1,False,True,True,42.558868408203125,20.73689079284668,48.18349075317383,34.61837387084961,0.0386740331491712,0.430939226519337,0.0883977900552486,1.0,27.0,4.0,24.33703781487116,25.262129445079257,22.175269968978004,36.829653201050235,32.10969902597478,32.15561550160049
259,262,263,"I look forward, as always, to my conversation with Ellen Zentner, but first, please allow me to offer a few remarks on the economic outlook, Federal Reserve monetary policy, and our new monetary policy framework.","I look forward, as always, to my conversation with ellen zentner, but first, please allow me to offer a few remarks on her economic outlook, federal reserve monetary policy, and our new monetary policy framework.","I look forward, as always, to my conversation with ellen zentner, but first, please allow me to address one of my main concerns.

ellen,

it has been suggested in some of these discussions that my","I look forward, as always, to a conversation about this particular issue, but first, please allow me to offer a few remarks on the economic outlook, federal reserve monetary policy, and our new monetary policy framework.",2,1,False,False,False,42.96719741821289,31.08292961120605,25.10753059387207,29.604366302490234,0.0283018867924528,0.4575471698113207,0.1273584905660377,8.0,37.0,10.0,21.078313200351168,19.191766568786903,22.604753206436285,36.43079590009522,33.52678556398536,35.089309055721685
260,263,264,"When governments resort to printing money to finance their spending, inflation rises and nominal assets lose their value.","When governments resort to printing money to finance their spending, the interest rate rises and nominal assets lose their value.","When governments resort to printing money to finance their spending, they create a financial bubble. as the u.s. treasury recently discovered, the $3.6 trillion in new government","When governments resort to printing money to finance their spending, inflation rises and nominal assets lose their value.",2,1,True,True,True,34.73075485229492,33.80475616455078,41.52634048461914,41.52634048461914,0.1157024793388429,0.7024793388429752,0.0,4.0,26.0,0.0,19.32761155922552,23.11304040505116,19.16033394968692,29.870695184073746,30.325095634262333,31.058226173894965
261,264,265,"The first is what to do about supply shocks, like large increases in oil prices, which tend to increase both inflation and unemployment.",The first is what to do.,"The first is what to do about supply shocks, like large price declines. the second is what to do about inflation. the third is what to do about wage growth.

the","The first is what to do about supply shocks, especially large changes in oil prices, which tend to affect both inflation and unemployment.",1,2,True,True,False,47.01753616333008,15.379289627075195,35.54206085205078,29.04923248291016,0.8235294117647058,0.5514705882352942,0.1617647058823529,30.0,31.0,4.0,16.56423416860613,21.488274251168853,17.297300094346348,26.35309599076217,28.02400151638264,24.91518549163037
262,265,266,"Although readings on core inflation had improved modestly since the spring, nearly all participants viewed core inflation as uncomfortably high and stressed the importance of further moderation.","Although readings on core inflation had improved modestly since the spring, most participants viewed core inflation as uncomfortably high and stressed the importance of further moderation.","Although readings on core inflation had improved modestly since the spring, nearly all economists surveyed in january said they thought the economy would continue to expand at the sluggish pace it has in recent months. the consensus","Although readings on rising inflation had been modest overall since the spring, nearly all participants viewed low inflation as a high rate as the result of further moderation.",1,2,False,True,False,52.615867614746094,38.0038948059082,105.33165740966795,54.55388259887695,0.0515463917525773,0.5618556701030928,0.2783505154639175,2.0,38.0,16.0,16.49353924032959,21.538025170564804,24.40966221249105,39.5323355293481,28.574670881572853,35.78017278975183
263,266,267,"This conclusion is buttressed by recent sizable increases estimated for labor productivity for the manufacturing sector, derived from a data system that, for the most part, is independent of the national accounts.","This conclusion is buttressed by the sizable increases estimated for labor productivity for the manufacturing sector, derived from a data system that, for the most part, is independent of the national accounts.","This conclusion is buttressed by recent sizable increases estimated for labor productivity for the manufacturing sector, and by the fact that productivity growth in the sector has been relatively flat for over a decade now. indeed, it is now","This conclusion was buttressed by recent sizable increases estimated for labor productivity for the manufacturing sector, derived from a data system that, for the most part, is independent of the national accounts.",2,0,True,True,True,39.264610290527344,31.75919532775879,47.06716537475586,45.01167678833008,0.0234741784037558,0.4272300469483568,0.0093896713615023,1.0,36.0,1.0,27.45258313067852,22.38040229415291,25.760584758583057,33.74939089414292,29.576006400322232,34.299043184972426
